path,text
3/3829.wav,世界で一番高い住宅は、インドにある、アンティーリア、というじゅ
3/3830.wav,スマートフォンの充電コードは、短いものの方が、早く充電されるらしい
3/3831.wav,海賊がピアスをしているのは
3/3832.wav,本編では出てこない
3/3833.wav,南極では、あまりの寒さのため、ウイルスが存在しておらず、風邪をひくことがない
3/3834.wav,しゃっくりを止めたい時は
3/3835.wav,摩周湖は、法律上
3/3836.wav,北極熊は、毛は白いが、肌の色は黒
3/3837.wav,カリウム不足の場合があるので
3/3838.wav,マヨネーズは、開封前に冷蔵庫に入れると
3/3839.wav,酢と油が分解してしまい
3/3840.wav,悔しい時や、怒っている時はしょっぱく
3/3841.wav,1円を作るための材料費は
3/3842.wav,コショウは入っていない
3/3843.wav,亀は、生まれた時の温度によって
3/3844.wav,いしゅう半分の長さになる。
3/3845.wav,世界で一番高い住宅は
3/3846.wav,百六十八台停められ
3/3847.wav,スマートフォンの充電コードは、短いものの方が
3/3848.wav,早く充電されるらしい
3/3849.wav,もち花火の先端の紙は
3/3850.wav,ういう風習があったためである
3/3851.wav,地球上にあるすべての砂粒よりも、はるかに
3/3852.wav,という有名なセリフは、本編では出てこない
3/3853.wav,お菓子メーカーのロッテが、最初に販売した商品は
3/3854.wav,赤いマントに闘牛が突進するのは
3/3855.wav,揺れているものに、警戒するためで
3/3856.wav,バナナや、アボカドを食べると良い
3/3857.wav,歯ブラシのような味がする
3/3858.wav,道路交通法で、自転車と同じ
3/3859.wav,クロースが、赤い服を着ているのは
3/3860.wav,タラバガニは、カニではなく
3/3861.wav,人は、一生のうち
3/3862.wav,30秒以上かかる場合は、太りにくいらしい
3/3863.wav,足の裏を除菌すると
3/3864.wav,スマートフォンの充電コードは
3/3865.wav,サケはもともと白いが
3/3866.wav,オキアミを食べているうちに
3/3867.wav,お菓子メーカーのロッテが
3/3868.wav,赤いマントに闘牛が突進するのは、揺れているものに警戒するためで
3/3869.wav,マリオブラザーズに出てくる
3/3870.wav,ヨシザウルス、むんちゃく
3/3871.wav,自転車と同じ、軽車両にぶん
3/3872.wav,酔っている人の手を
3/3873.wav,イヤモンドでできた星が
3/3874.wav,歯医者の数は、コンビニよりも多い
3/3875.wav,消しゴムがない時代は、消しゴムの代わりに
3/3876.wav,裏面には、ライオンの紋章が、書かれている
3/3877.wav,寝ているあいだに、十匹のクモを食べている
3/3878.wav,プーマとアディダスの創設者は
3/3879.wav,30秒以上かかる場合は
3/3880.wav,世界で一番高い住宅は、インドにある
3/3881.wav,二十七階建てで、駐車場は、百六十八台停められ、総額は
3/3882.wav,スマートフォンの充電コードは
3/3883.wav,葬式代にする、という風習があったためである
3/3884.wav,ちゅうにある恒星の数は、地球上にあるすべての砂粒よりも
3/3885.wav,コアラの、1ヶ月の食費は
3/3886.wav,牛は、白と黒しか認識できない
3/3887.wav,揚げ物が無性に食べたい時は
3/3888.wav,マヨネーズは、開封前に冷蔵庫に入れると、酢と油が分解してしまい
3/3889.wav,マリオブラザーズに出てくる、ヨッシーの本名は、ティー、ヨシザウルス
3/3890.wav,牛と馬は、道路交通法で、自転車と同じ、軽車両に分類されている
3/3891.wav,ちえんを作るための材料費は
3/3892.wav,口紅の材料になるこ
3/3893.wav,るめのように干からびてしま
3/3894.wav,鉛筆一本で、およそ
3/3895.wav,人間ひとりの血管を
3/3896.wav,もうちょっと寝てたらいいのに。いいの？ここがいいの？そ
3/3897.wav,この時間帯っていっつもなんか外でー、トラック動いてるよね？
3/3898.wav,面白くはないな。はー、勉強だから。
3/3899.wav,痛い、痛いよー
3/3900.wav,ね、いや、これを先にやっとくんだよ
3/3901.wav,休みの日は、わたしにかまえと
3/3902.wav,それはー、ねぇ、俺もー、望んでるところではあるんですけ
3/3903.wav,ね、聞いてるよ。えー？いつもこんなでしょ？
3/3904.wav,そのあと？そのーあと？そのあとーはー
3/3905.wav,そのあとはね
3/3906.wav,わかってないよ。もうねー。すぐまたごまかしてるって言うでしょー
3/3907.wav,ちょっとだけ電話してもいい？
3/3908.wav,あ、もしもしー、お疲れ様ですー
3/3909.wav,今大丈夫？あーあー全然大丈夫。あのさー
3/3910.wav,いいよ、そのまま、寝ても
3/3911.wav,うーんとー、なんだろうなー、その全部できるって言ってしまうと、そうそうそうそうそう
3/3912.wav,だからある程度のところでー、も、もしジャッジにいっぱ困ったら電話してもらってもいいし
3/3913.wav,今のはねー、部下だねー
3/3914.wav,いやいやいや、調子乗ってないよ
3/3915.wav,出来上がるまでちょっと寝てな。うんいいよ、ここで寝ても
3/3916.wav,わたしあのいろんな人形の話がありますがね、たくさんありますが。でもその中で、
3/3917.wav,まーそのーだいぶ昔のことになるんですが、ずーっと続いてましてね。
3/3918.wav,でこのまま入院しちゃいましてねえ、でさすがに二度ともう言ってこなかったです。あーこれまずいなぁと思った。
3/3919.wav,でーシブヤの番組ですからね。でまずスタジオ入った。
3/3920.wav,おぉ雰囲気出してんなぁ音出してんなぁと思ったら、ドドドドドドン!っとまぁ局ですからね。音声さんですか？2人で飛び込んできて、でーその先輩のほうが、おいこれどうなってるんだおえ
3/3921.wav,でーそうこうして、何かがあって一旦出たんですよその、スタジオ前のその、長椅子があるんでそこは一旦出をつけようと。
3/3922.wav,サイレンが鳴ってるんですよ。ああーと、なんだあのサイレンって言ったら、スタッフが飛んできて、すいません稲川さーん、あのお願いしたーその霊媒師の方なんですけど、今そこで轢かれちゃいましたと、なにって
3/3923.wav,モニターにわたしが映っているここに、映ってるんだよ男の子。
3/3924.wav,わたし不審者と思ってさすがにうおーって思った。
3/3925.wav,そしたら女性アナウンサーがね、キャーって泣いちゃったんですよ。
3/3926.wav,見えてます。何って、えっBさんが、もう喋っちゃったよ。
3/3927.wav,でいて、これどうやって操るのって聞いたから、ああ、そうか、
3/3928.wav,もうなんか魂抜けちゃったから、マルさん帰ろうか
3/3929.wav,あのー帰る時にね、ありがとうございましたーお疲れさんでしたーって言うんだけど、みんなそれどころじゃない。みんな完全放心状態ですよね。
3/3930.wav,ところがこれで帰った新幹線。そっからと
3/3932.wav,ここからスタートしてるんで、怖い、はい、では、入りましょう
3/3933.wav,えー、こんばんは。今ここにいらっしゃいますかー?少しお話できないでしょうかー?ちょっとこのままスピードボックスもやってみたいと思います。
3/3934.wav,なるほどなるほど、っていうことはその男性の主張が強くても全然これはーあ
3/3935.wav,さらにこの動画であの1階奥に進んでいくと思うんですけどー、このお風呂を過ぎてーさらにまっすぐ行った一番奥の部屋
3/3936.wav,その人たちってー、いまだにそこになぜ、いるんですか？
3/3937.wav,あーなんかー、入ってんちゃうか
3/3938.wav,え、ちょっとでっ、えっ、誰?え、誰ですか?
3/3940.wav,笑ってしまう。俺とディエコの間もんすてろか
3/3941.wav,エグイ!めっちゃ反応してる!
3/3942.wav,何時間かかるかはちょっとわからないですが、しっかりちょっと、検証していきたいなと思います。では行きましょう。
3/3943.wav,えーとー、ま見てもらったらわかるんですけど、一つ。
3/3944.wav,今ずっと携帯触っとったんですけどー
3/3945.wav,いやなんかねー、めっちゃ胸痛いんすよねー
3/3946.wav,なんかもうぎゅーてされてるなんかめっちゃ苦しいんすよー。もうめっちゃ嫌な予感するんすよ
3/3947.wav,すみません少しだけお話してもらってもいいですかー?
3/3948.wav,何がこんなに俺嫌なんやろマジで
3/3949.wav,宴会場で、めちゃめちゃ反応してたって言うとったんで
3/3950.wav,あかんめっちゃ苦しい何これマジで。なんか体の中入ってないかこれ？
3/3951.wav,ここは多分もともと、壁があったのを、解体で、なくしてる感じですかね
3/3952.wav,え、ここでもちょっとー、えー
3/3953.wav,はい、ではちょっとー、牧場に来ましたのでえースピリットボックスやっていきます。
3/3954.wav,はいえー、やかず一人タイム行きます。もうめちゃめちゃ行きたくないですね
3/3955.wav,めちゃくちゃしんどい。あかん、まじでこれもう、きっついなぁー。であきそう
3/3956.wav,螺旋階段もやばいし、もう全部やばい
3/3957.wav,トリフィールドの音聞いててくださいね。このジリジリ言うてるのがトリフィールドです
3/3958.wav,もう言ってた通りですね。序盤に。エグイエグイエグイエグイ。反応の仕方エグイ。
3/3959.wav,来てんなぁ、ついてきてんなぁこれ
3/3960.wav,そりゃこんな条件揃ってるところ、タダでさえ集まりやすいのに。結婚式場があったら…
3/3961.wav,今の女性の方まだ違う方ですね。
3/3962.wav,あたマジぶっ倒れそう
3/3963.wav,めちゃくちゃ古い人形ーなんですけどー、なんか藁ですね
3/3964.wav,今宵も月が、綺麗やなー。さあー出発や
3/3965.wav,だらしめん、ほらーチャンネル
3/3966.wav,こんばんはー。今、線香炊きましたので、お召し上がりください
3/3967.wav,え今回撮影で、来させていただいてます、でいごと申します
3/3968.wav,もしよかったら、お話ししませんかー?すごく違和感を感じるんですけど僕の近くにいらっしゃいませんかー?
3/3969.wav,なーに?今この近くにいらっしゃいますか?
3/3970.wav,あなたもこの場所で、自決された方ですか？
3/3971.wav,機械を通してですけどー、あなたの声届いてますんでー、何か僕に伝えたいこととかないですか?
3/3972.wav,もし、いるのであれば、声を聞かせて、もらいたいのですが
3/3973.wav,うるさいってゆったんかなー？ごめんなさいもう一度いいですか？
3/3974.wav,いや長いなーこれ、てかこれー、きょ一人タイム進んでやろー
3/3975.wav,兵庫県、しっかり怖いとこあるやん
3/3976.wav,えー、いや、いかんよ。いかんけどー。
3/3977.wav,ま、ちょっと反応はあるけど特にー、めちゃくちゃ反応せーへんなー
3/3978.wav,んーみたいな、
3/3979.wav,まチャンスというか、そういう状況を自ら作っていこうかなと思います。今日どうしよう？先行後行。じゃんけんしてみよか
3/3980.wav,はい、というわけで、完全に一人になりました。じゃあね、今から、一人タイム、やっていきます
3/3981.wav,ま、リアクションやらせじゃないですよもうマジでねー、なんかある思ったんす
3/3982.wav,久しぶりの、ガチ恐怖っすね
3/3983.wav,でディエゴがー、ギブアップしたんすよねー
3/3984.wav,よし、落ち着け、大丈夫や、うん、大丈夫、よし、はい
3/3985.wav,誰かいますか?なんかおるよな?
3/3986.wav,えーこんばんは、やはたつです。もしよかったらお話しませんかー？
3/3987.wav,あ今この反応してるのは別に特に、問題ないすね
3/3988.wav,一旦ちょっと戻ってきたんで、撮影、しに戻ります。ダラシメン、ホラーチャンネル
3/3989.wav,ま僕はですねー、まディエゴとま似たような感じのーま現象がありましてー
3/3990.wav,こんな目の前で見られたんかってたらそんなことはないですけど。
3/3991.wav,ま歩いている時にーえー手すりから白いもやがふわっ
3/3992.wav,これはですね今ほんとにこのエンディングーを撮っている、この今の段階では…
3/3993.wav,まとにかくですね、えーここはー、一人で撮影に来てはいけない場所。このぐらいまー危険な場所だったのではないか
3/3994.wav,もう表現に困るんですよね。この公園もそうですしーその奥の、トイレもそうですしー、もうここ一帯がとにかくやばいんですよね
3/3996.wav,シンプルに怖くてー、その何が怖いかって言われると
3/3997.wav,一番手前から一番奥まで
3/3998.wav,とにかく危険なんで、一人では絶対に行かないでください
3/3999.wav,入口の方から男の人の声聞こえた気がします。いや池の中？
4/4000.wav,まあそういうことがあってもおかしくないですよね
4/4001.wav,入口の方に比べるとー、全然
4/4002.wav,じゃあちょっと、戻っていきましょう。でこの折り返し、で使いたいのが、トリフィールドですね、えこちら起動していきましょう
4/4003.wav,今のところは、数値、ゼロです
4/4004.wav,一応一番高い場所でー、高さ三十メータ―あるみたいなんですけどー。ま見た感じこのあたりはまだそんなに高くないですね。おおよそまぁ二十メーターぐらいじゃないで
4/4005.wav,うっすらいけどなんか声が聞こえてる気がすんねんなぁ
4/4006.wav,ま反応している場所がー、さっき僕が足音が聞こえた、そして、女性の声が聞こえたって言った場所なんですよね？
4/4008.wav,では、公園の中入ってきますー
4/4009.wav,ちょっと僕には見えなくてですねー
4/4010.wav,先ほどここに来た子がー
4/4011.wav,男性のかたの声をはっきり聞いたっていうことなのでー
4/4012.wav,僕にも聞かしてもらえませんかー
4/4013.wav,ではちょっと二人が戻ってくるまで
4/4014.wav,とあかん方なんかなと、思ったりもした
4/4015.wav,でもところどころー、例えばトイレに行くまでトリフィールドの反応が全然なかった
4/4016.wav,なのでー、この感覚がどっちなんかわからへん、普通にもう冷静なのかー。まーデーボがー先ー、あかん想像
4/4017.wav,なんかねー、話すのも怖いん、ですよ
4/4018.wav,女の人の声なぁ。これは人やろ
4/4019.wav,女の…女の人の声やんなぁー
4/4020.wav,ちょと、なんか、驚いてるような声やんなぁ
4/4021.wav,釣りされてるかたいますかー?こんばんはー
4/4022.wav,ちょっと久しぶりにー、良かったなって今思ってること言うとー、しっかりここをー
4/4023.wav,この手の、火事に関してはあんまり怖かったっていう、過去の事例はないんすけど、今ここの時点で十分怖いんすよ
4/4024.wav,それとはもしかしたら別の霊がー、そもそもここにいるのか、もしくは
4/4025.wav,なんやろなぁ、でもこの不安な感じ
4/4026.wav,ちょっとですねぇ、始まってー2、3分
4/4027.wav,はい、というわけでここでスピリットボックスをやっていきまーす
4/4028.wav,こっちの方から、ハイヒールみたいな足音が、近づいてきましたね
4/4029.wav,ここで何があったか教えていただけますかぁ？
4/4030.wav,事件があったと聞きました。何か知ってることありますかぁ？
4/4031.wav,はい、えー、線香を焚けました。じゃ、この線香をー、持ちながら、えー、まずはですねー、スピリットボックスを使わずに直接会話をしていきたいと
4/4032.wav,今回ちょっとお仕事でー、こちらにやってきたんですけどもー
4/4033.wav,もしそうであれば手すりもう一度、叩いてもらってもいいですか？護摩線香を焚いているのでお召し上がりください
4/4034.wav,何もないこの山っかわの方もちょっと気持ち悪いです
4/4035.wav,なのでこの辺りも全般ですね
4/4036.wav,トリフィールドの反応は、今のとこないですね
4/4037.wav,うっすら苦しそーな声みたいなんが聞こえるんですよね
4/4038.wav,今からですねー、機械を使ってー、ここにいる方にお話ししていきたい、おおー、来てるねー
4/4039.wav,もっといったから返事してもらっていいですか?
4/4040.wav,僕のできる範囲であればぁ、おっしゃってください。やりますんで
4/4041.wav,本当にこれでちょっとー、お腹を満たせるかはわからないんですけど
4/4042.wav,今もちょっとうるさいんですけど始めまーす
4/4043.wav,今回ですねぇ、えー、向道ダムの撮影ですね
4/4044.wav,でもー、なんかそれをやり終わったあとにですねぇ、今までなかってのは当然やったんやろ
4/4045.wav,におるのかどうかの検証っていうよりもおる上での検証の方が、やっぱり寄り添ってくれてなんか
4/4046.wav,あそこにー、やっぱり実際に僕が話してた人達っていうのはー、あー存在しましたか？
4/4047.wav,僕がお水をー、この渡したんですけどー
4/4048.wav,ふへへっ。本当に綺麗に伝わってるっていう、も本当綺麗な流れというか
4/4049.wav,そのー、ゲイゴさんがひとりタイムにー
4/4050.wav,あのね。ここからーそのメインの端か
4/4051.wav,えぇー、ってことは、いまだに成仏しきれずに、まだやっぱりいたんですね？
4/4052.wav,スピリットボックスの中からいるよ。あ、見てて!
4/4053.wav,ま、そういうことが分かった動画やったっていうことですよね
4/4054.wav,そういう陽気な感じには近づいては来ないんですか？
4/4055.wav,いやー、嬉しいってからの
4/4056.wav,あ、怖っ!ちょっと待ってよ!今は待ってください。ごめんなさい。
4/4057.wav,やっぱりさっきとおんなじようなこの平らな、石
4/4058.wav,っぱ、120人も人がいたからー
4/4059.wav,今回僕が選んだ心霊スポットがー、葛岡墓苑、こちらにやってまいりました
4/4060.wav,その搭を半時計回りに三周するとー
4/4061.wav,良くないことが起きる、そう言われているみたいです。
4/4062.wav,赤子の霊を見た、また赤子を抱いた、えー、女性を見た。
4/4063.wav,はい。えー、3周回りました。えー、こちらの恐怖レベルが1でお願いします。特に何もないです。
4/4064.wav,もう無理や。怖い!
4/4065.wav,ふつうーに足音聞こえたんですけど
4/4066.wav,うわぁ、ちょっと嫌な感じするなぁ。登ったら神社があるのか
4/4067.wav,昔の崖やけど、ここやったら引っかかって終わりですもんね
4/4068.wav,ここかー!これちょっと怖くない?
4/4069.wav,も、真下の、もう波の荒さが、もう、すごいんすよ。もうこれね、高さ云々じゃなくて、
4/4070.wav,もう、なんか呼ばれてるんじゃないかなっていうそんなー、自然にね、そんな感じが、こうし
4/4071.wav,そんな敷地自体は広くなさそうですね。あ、むしろ狭いんか。
4/4072.wav,はい、えー、では行きましょう。
4/4073.wav,まずー、ま、反対側もおんなじようにこの高いフェンスがあって、上に有刺鉄線が巻き付けられてるんですけど、よく見るとー、見てください。
4/4074.wav,で、なぜこれがー、こんなにもー、内側まで付いてるかというと、ちょうどここで切れてるんですよね。それがー、
4/4075.wav,た、遠いところからわざわざ来たから？
4/4076.wav,わかりますか？本当にめっちゃ白いんですよ。一切汚れてる様子がないんですけど
4/4077.wav,え、こんばんは。持って良ければお話ししませんか？
4/4078.wav,ほかにも何か話してもらうことはできないですかー？
4/4079.wav,ここで何があったか教えてもらうことはできないですかねー？
4/4080.wav,ある程度ー、ちょっと噂は聞いてはきているんですがー
4/4081.wav,もう全然他には反応ないんですけどー
4/4082.wav,若めの男性のような声っすよね
4/4083.wav,やらせかっていうぐらい、もうめちゃくちゃはっきりするよね
4/4084.wav,も、怖いっていうよりもすごいなっていう感じですよね
4/4086.wav,さてはこの世、世界は残酷だな?ちょっと待って、その…
4/4087.wav,みんなねー、センシティブ、だかねー
4/4088.wav,ちょっとそういうー、風に捉えられるなって思ったらすぐセンシティブって言うから
4/4089.wav,よくないよ!俺はそういう文化を変えていく!
4/4090.wav,はあー、絶対に字面的にねー、あの大変感動的な声でございましたのが面白いよ。
4/4091.wav,彼女さん可愛いですねー
4/4092.wav,わたしは貧乏神のもみじ
4/4093.wav,ご自分の世界に戻られるおつもりなのですね
4/4094.wav,自分のことは自分で行動に出なきゃー
4/4095.wav,と共に消えてしまう、ひとよの夢
4/4096.wav,一刻も早く、元の世界へ
4/4097.wav,まずはわたしが不在となる、明日の午後の営業が
4/4098.wav,ちんとご挨拶したかったものですからー
4/4099.wav,みんなとっくに持ってる。ふっ
4/4100.wav,手紙は嬉しいけど、最初から断る気でいるよ
4/4101.wav,相手が誰であっても、アヤの方が好きだ!
4/4102.wav,現在高校野球のレベルは、日本が世界一と言われ、メジャーのスカウトが甲子園にまで来る時代。
4/4103.wav,実力は比例しなくても、誰よりも努力してますわ
4/4104.wav,まあーいい。やる気があるのは結構だ
4/4105.wav,その調子で精進し、早く一人前となれ。
4/4106.wav,安心しなこさき、チャンスぐらいは作ってあげるから
4/4107.wav,バケモノは俺が今切った!
4/4108.wav,みなさんー、ごきげんよう。これから…
4/4109.wav,快眠をしたい方
4/4110.wav,心地よく眠りにつきたい方のために
4/4111.wav,はい、では、今回は綿棒で
4/4112.wav,気持ちいいですかー?
4/4113.wav,軽くなりましたかー?
4/4114.wav,すっきりし始めましたか？
4/4115.wav,空気がよく通るようになりましたか?
4/4116.wav,あい深ーい眠りに落ちてくださーい。
4/4117.wav,これで眠りに、誘われる
4/4118.wav,だんだん、深ーい深ーい、海の底に落ちるように
4/4119.wav,眠りに落ちましたかー?わたくしの話す声が聞こえなくなりましたか?
4/4120.wav,海の底に、落ちていってくださーい。
4/4121.wav,天に天に、昇っていきまーす
4/4122.wav,心地よくなりましたかー?
4/4123.wav,大きな深ーい眠りに誘われましたかー?
4/4124.wav,くよう入って大阪での路上ライブやってたとこなんですけども、あそこでやってます。乱入してみようと思います
4/4125.wav,クリスタルパレスで、立派な教育を受けさせるぞ
4/4126.wav,お前に頼みがあるのだがー、聞いてもらえるか?
4/4127.wav,その経緯はよくわからんが、ローザはー、当時の皇帝のお気に入りだったらしい。
4/4128.wav,伝説では、偉大なるカール一世が
4/4129.wav,彼はー、隠し場所を己の中に秘したまま没した
4/4130.wav,それゆえ、アクアマリンがクリスタルレイクのどこにあるのか、誰にもわからないのだ。
4/4131.wav,それゆえ、密かに探索してほしい
4/4132.wav,アクアマリンの件はもういい。忘れてくれ
4/4133.wav,リアナもまだ死んだと決まったわけでもない
4/4134.wav,もう10年ほど前だー。成人した証としてー、何かをしようと考えた。
4/4135.wav,自分もー挑戦してやろうとー、スカーブ山へ出かけた
