path,text
1/1904.wav,いぬいの背後に回って大声出したいわたしの背後を簡単にとれると思うなよ。さて、というわけでわたしはー…
1/1905.wav,わたしはーねっ、このあともねっ
1/1906.wav,やることがねっ、あってねっ。
1/1907.wav,ううビール5個とタバコ5個…だばす…ビールは自分でやってもらわんと。持ってきてくれねえか？
1/1908.wav,おれ？ちげーよー。あはっ
1/1909.wav,再生したくないなーって、いう気持ちがー
1/1910.wav,あってー、何をとは言いませんけど。
1/1911.wav,ちょっと待ってな、なんちょなんかあ頭なんか入ってない？
1/1912.wav,これ、見切れてるー、んじゅの声は何ですか？
1/1913.wav,怖くないよー、怖くないからねー。やだじゃないねー。今度の配信でまた会いましょうねー
1/1915.wav,少しはー絆が深まった？
1/1916.wav,こんにちは素敵なお嬢さん。
1/1917.wav,飛んで逃げてもつままれてプチッ!さ
1/1918.wav,僕の知ってる村政じゃあないのかー。あはっなら約束はご破算だね。残念だよ
1/1919.wav,お、あれ責任をおっかぶせるってことだろ？出撃だ、マスターよーし、やるぞー!
1/1920.wav,さわがしいけどー、なにこれ?
1/1921.wav,はってじゃあー急いで支度しなくちゃだね
1/1922.wav,嫌いなものはー、取りたてかなぁ。いつか返すんだから、そこは僕の誠意を信じて欲しいよねー
1/1923.wav,好きなものかぁい?いやー多すぎて一言では言えないなぁ
1/1924.wav,俺と君は契約上の関係でしょう。それ以外ある？
1/1925.wav,おーめぇ、休んでいるところなんだー。話しかけないでくれるぅ？
1/1926.wav,奴らは惨めな負け犬
1/1927.wav,ほう、俺はきっちり目的を果たした。勝馬だ。
1/1928.wav,けっ、きょく、行き着くところに行っちまったかー。
1/1929.wav,まーっず…アルビオンがいる…退散退散…、でも惜しかったなぁ
1/1930.wav,あれー？汎人類史の方じゃなくてー、妖精国の方のバーバンシー呼んだんだー。
1/1931.wav,もしかして、更生できると思ってる？
1/1932.wav,バーゲストには悪いことをしたと思ってるよー、うん。でも、ほらー自業自得だしねー
1/1933.wav,凄いな彼、こっちでもああいうキャラなんだー。
1/1934.wav,最後まで生き残るわけだー
1/1935.wav,聖杯には泥が詰まっている
1/1936.wav,終わりを望む俺を生み出した泥にそっくりだ。人間の願いってのはー、つまりそういうことだろう？
1/1937.wav,主従関係？この世で五本指に入る
1/1938.wav,嫌いなものねー。多すぎるからこそ一言で言える。何もかも、だよ。
1/1939.wav,あんたは俺の旧敵だった。あんたが余計なことをしなければ、俺が生まれることもなかった。
1/1940.wav,あんたの死に際に俺は立ち会えなかっ
1/1941.wav,何だってこんなことになっている
1/1942.wav,ああそう。人理が安定するまでは嘘も嘘のまま通るってこと
1/1943.wav,あーあ、いいよ、諦めた。そういう人間だもんなあ君は
1/1944.wav,呼ばれたからには力を貸すとも
1/1945.wav,レベルアップは霊気の成長。霊気再臨は存在そのものの変身なんだねー
1/1946.wav,美しいものはその前提が醜く
1/1947.wav,たまたま歩いてて見かけて、そこでついてきてるよって。で様子見てるんだって。お店の方にも行ってるよー
1/1948.wav,福士原福島、よくわかんないです。何で亡くなったんですか？誰ですかこのき？
1/1949.wav,テレビゲーマーのやつのテレビは
1/1950.wav,うん後何処行くの?恐山とココと?おうち?おうち何処にあるの?
1/1951.wav,ごめんね、テレビゲーム、だけ答えられない。おうおぅそう、ご飯もそうだけどごめんよ
1/1952.wav,同じ、色色はわかる?色わかる?
1/1953.wav,初回は、10月13日、開講となります
1/1954.wav,たしかな事柄については四柱推命や、気学では、限界がありまして、こういった場合、
1/1955.wav,対策や解決方法も説明いたします。
1/1956.wav,募集させていただくこととなりました。今回は、ユーチューブなどのメディア露出、可能な方が対象と
1/1957.wav,フッ。ドアーフ鉱山で、宝石の採掘中に発見された、魔法石に
1/1958.wav,大会に出られれば、その勇士は世界中に放映、さらに満席のコロシアムの喝采を浴びることができます。
1/1959.wav,せい泣きながらみんなの魔法吸い上げてさぁ、超ダサかった!ちょっと幻滅ぅ。
1/1960.wav,このマイクを握るんだ。そして
1/1961.wav,コロシアムの外で待機する客を楽しませるため
1/1962.wav,で、ルーク先輩がヘアセットしてくれたんだよ
1/1963.wav,フロイドはすぐにボウタイをほどいてしまうんです。
1/1965.wav,どうも、科学ヤバいチャンネルなかのひとの青田です。今回は、地球史上最大の音、というテーマで動画をお送りしていきます
1/1966.wav,クラカタウ島はインドネシアのジャワ島とスマトラ島の間に位置します
1/1967.wav,この時の爆発音は、世界各地で記録されています
1/1968.wav,ジェット機のエンジン音を近くで聞いた時が百二十デシベル
1/1969.wav,人間の聴覚が耐えうる限界は百三十デシベルほど、と言われています
1/1970.wav,ナオ君が、黒髪が好きって言うから、トミ、あした止めてこようと思ってるんだ
1/1971.wav,うみは男で髪染めるんや、うちやったら、自分のスタイルは、絶対に変えたくないし、変えへんわ
1/1972.wav,鍵を閉めるから、早く出なさい
1/1973.wav,そ、そんなに驚かなくても
1/1974.wav,本借りたいから、手続きしてくれる?
1/1975.wav,貸出手続き終わりましたよ
1/1976.wav,うちのヘッドホン返してもらえませんか?
1/1977.wav,ぱん的には、あまり知れ渡っていないから、初めて同士に会えて嬉し
1/1978.wav,会社の同僚に見られたらどうするんだよ
1/1979.wav,すぐ買い物してくるから、待っててね
1/1980.wav,ひとみちゃんさ、面倒ごとに、俺を巻き込むのやめてくれないかなー
1/1981.wav,なんていうか、ひとみちゃんって思っていた子と、違うわ
1/1982.wav,もっと融通のきく、大人な子だと思っていたけど、違ったね
1/1983.wav,せやから、やめときって言うたやん
1/1984.wav,これは、どういった、ゲームなので、しょうか？
1/1985.wav,もっとじどうせいっぽく言った方がいいのか?
1/1986.wav,これはどういったゲームなのでしょうか？
1/1988.wav,いやー、委員長さんとかんごちみたいにはできないなー。んー、こっちうまいよねマジで
1/1989.wav,わたしもそう思います。あの委員長さんのあれ好き
1/1990.wav,またですね、右下にある、こちらのスピーカーのアイコン、こちらをですね使います。
1/1991.wav,右クリックをして、サウンドの設定を開くというのをクリックしてくださ*い。
1/1992.wav,そうするとこのような画面になってきます。ここで、詳細というのを押してください。ここですね。
1/1993.wav,ここです。サウンドの問題のトラブルシューティングというのをクリックしてください。
1/1994.wav,歯車ボタンですね。設定の方また左クリックして
1/1995.wav,更新とセキュリティというのありますねこれをクリックします。
1/1996.wav,ここですね。更新プログラムのチェックをクリックして、最新のWindowsアップデートがないかを確認してみてください。このパソコンはもう既に最新版になっていますので、今クリックしても何も出ません。
1/1999.wav,これはでも多分人が動かしたんちゃうかなー?
2/2002.wav,見られている感じこっちを、うかがっている感じがすごい強くて
2/2004.wav,いち、に、二名、三名、うち
2/2005.wav,お一方、すごいのが、すごい力を持たれてんのが一人、かな？あと二方、さんよん
2/2007.wav,画面ー、いっちょい左？
2/2008.wav,で、えーと、離れてにー、さんの、よんごっ、て形かな。
2/2009.wav,これ、多分女の人と、男の人やと思う。年齢は
2/2011.wav,なんでこう…、わたしこんなこと初めてなんですけど。ちょっと待っててもらっていいですかー?
2/2012.wav,え見つからないと思ったら全然普通に机の上にあったし
2/2013.wav,でもリングコーン。やっぱしつあんまり使ってないのがやっぱバレるよなそういうのほんと
2/2014.wav,たのみんな?なんか、みんなのコメントの、感じがおかしいんだけどどうしたの?え?なんかあったの?
2/2015.wav,うーん、でもまあ、あれだね、なにー?みたいな
2/2016.wav,寒いからな、ちゃんと被らなあかんで、布団。うん、ふぅー
2/2017.wav,当たってる?知らんわ。ふふっ
2/2018.wav,いひゅん何何何何?おっ何？
2/2019.wav,俺の方が好きやで
2/2020.wav,どっちも同じやなそれやったら。引き分けードロー。んふふ。んー、好き
2/2021.wav,もう寝れへん、もう寝れへん、うふふ、寝れへんねんけどー、か楽しいから。なんなの?
2/2022.wav,こっちのセリフー。いやこっちのセリフよ。
2/2023.wav,はい、うん、次のキスで寝よ。次キスしたらもう寝る。おやすみの代わりにキスで
2/2024.wav,次キスったらもう寝る。OK?
2/2025.wav,普通にリア充してんの？ふふふ、なんか、ね
2/2026.wav,幸せすぎるのかもな、ふふふふ、幸せすぎてなんか感覚狂ってんのかもな
2/2027.wav,あのさぁー、こないださぁー、なんか他の男と通話してなかった？
2/2028.wav,いや、絶対してた。絶対男やった。
2/2029.wav,お前も俺のことを、ちゃんと愛してくれてるよなー？
2/2030.wav,もっかいひけつちゃー
2/2031.wav,ランプ開い、開け、開け、無理、開け
2/2032.wav,ふふっ、こーら足閉じんなって、閉じんな
2/2033.wav,ふん?俺も独り占めしてくれんの?ひひっ、ありが
2/2034.wav,今日も聞いてくれて、ありがとうな。チャンネル登録、詳細文からツイッターのフォロー、よろしくな。
2/2035.wav,こんな感じです。その際にお腹を触りながらやってみてください。すと発音する回数分お腹が動いていれば成功です。ではいきます。さん
2/2036.wav,あ、この声を乗せていく際に声帯のテンションが抜けないように意識してください。またこの時声の方向は前方向をイメージしてみてください。ああー
2/2037.wav,一番最後、グーで伸ばしているときは、下げっ放しをキープする感じです。
2/2038.wav,なーんてことだ!囚人がいきなり暴動を起こしている!鎮圧するぞ!特別警備隊、催涙ガス用
2/2039.wav,うん、やっぱり催涙ガスじゃ…
2/2040.wav,何この声…?おーたっ
2/2041.wav,ずいぶん愛苦しい声になったじゃねえか、そっちの方が愛嬌があって良さそうだな夕顔先
2/2042.wav,これは一体、何の騒ぎです？
2/2043.wav,むこれですか?これがどうかしたんですか?
2/2044.wav,さしずめ催涙ガスと間違えてヘリウムガスを撒まいてしまっ
2/2045.wav,この雑談リレーというものをやらしていただいておりますけれどもー
2/2046.wav,ジョーカー!マキシマムドライブ!
2/2047.wav,ロック、オン!
2/2048.wav,いやだから違う野球選手に多分なってますよ。うん
2/2049.wav,そうするときっと、草野球を極めたいと思うんでしょうね。だから真剣に草野球をやるっていう、野球選手になるんじゃないですか
2/2050.wav,あんせいの後ろののれんに注目してくれ
2/2051.wav,えーお客様にお知らせいたしまーす。えーただいまこの電車におきましてえー
2/2053.wav,彼を信用していけないよと、
2/2054.wav,彼に言ったという話をしてるんですね。ちょっとややこしいですね。
2/2055.wav,になるんですねー。今からリピーティングしてみましょう。
2/2056.wav,そしてライトゥー誰々は誰々に対して嘘をつくという意味ですね。え彼に嘘ついて悪いなぁと思ったと言ってます。
2/2057.wav,頑張って頑張って、頑張って頑張ったものにだけ、休憩は
2/2058.wav,今僕が、あなたを応援している意味、あなたが作業している意味、それを一つ一つ、考えてみましょう
2/2059.wav,やる気が、また湧いてきませんか？
2/2060.wav,どうですか？進んでますか？
2/2061.wav,ダメダメ。集中集中
2/2062.wav,それぞれ、夢なり目標なり、あると思いま
2/2063.wav,背中を、支えることはできないけど
2/2064.wav,ちょっと休めばいい。ただ、休むのは、まだ早いですよね
2/2065.wav,今までの時間が、無駄になってしまう
2/2066.wav,わたしも、ここからずーっと応援していますから
2/2067.wav,違う違う。そう、それそれ
2/2068.wav,いやいや、背筋を伸ばしたっていうようなことじゃないです。今のは少し
2/2069.wav,そうなれば、こっちのもんです
2/2070.wav,記録には、この他、歌舞伎の名調子を読み上げたものもあります
2/2071.wav,えこれらの記録は明後日東京墨田区の、江戸東京博物館で開かれるシンポジウムで発表されることになっています。
2/2073.wav,交響曲、等を聴く予定にしております。ではみなさん、ごきげんよう。
2/2074.wav,堀内海蔵さんの音楽の泉でした
2/2075.wav,JOBＫ、大阪第一放送です
2/2076.wav,今日の、京阪神地方の空模様は、朝のうちは、曇りですが、後次第に晴れとなりましょう。
2/2077.wav,我が国の、原子物理学の、育ての親である
2/2078.wav,故、仁科芳雄はくしの功績を記念する、学術奨励財団が、明日発足することになりました。
2/2079.wav,この財団は、仁科記念財団と呼ばれ、仁科はくしの教え子、東京教育大学の友永教授らが中心となり計画したものです。
2/2080.wav,横浜大学の、横山、ひろゆき助教授らが調べたところによりますと
2/2081.wav,あこれについて立教大学理学部の、武谷三男教授は
2/2082.wav,なお一行は、10時に、手荷物の税関検査を受け、11時半までに乗船を終わり、正午出航することになっています。
2/2083.wav,外電で、ベルリン発AFP
2/2084.wav,ウルブリスト副首相は、これまで9人の副首相のうち、筆頭の地位を占め、今度正式に、第一副首相となったわけです
2/2085.wav,あー、うーうー、あーはー、ふーふー、あーあー、うー
2/2086.wav,でも鶴の一声っていうのがあるでしょ？ね、東海三県
2/2087.wav,体が大きいき、大きいから体力があるという風に見がちなんだけども、体の大きさと、んー、体力っていうのは、違うん
2/2088.wav,段階を経て、作り上げてきた、っていうのが、きょね
2/2089.wav,それだけの体力がー本人にはーあるかどうかっていうのは
2/2090.wav,だから投げられるんだったら投げはせるっていうのはちおじあ
2/2091.wav,えー奥側は、おちかえぼぶ、コントロールで。
2/2092.wav,日本シリーズでああいうピッチングをしてるから、そら期待はしたいんだけどもー
2/2093.wav,だ違和感あったら、投げられないというのがピッチャーだからうんー、そこは野手とちょっ
2/2094.wav,球の速いピッチャーに、一番苦労するんだろう
2/2095.wav,自分の体がうぁー覚えてくれるわ。い反応してくれる
2/2096.wav,に対する、ピッチング―されたら
2/2097.wav,本心を言うと、あれは、うぁ
2/2098.wav,そうしたら後は何もできない。だからそれがなければー
2/2099.wav,そうすると落ち着いて野球できるだ。
2/2100.wav,ホームランも率も打点もみんなやー求められるっていうのは
2/2101.wav,お前も、こんな館内にいたくないよな？
2/2105.wav,全くいかないけどー、今回の50万はもう仕方ないか
2/2106.wav,数日後、義父が一時帰国。
2/2107.wav,義実家で再度話し合いが行われ、まず義実家の任意売却の件、誕生日パーティーで散財した50万円のお説教
2/2108.wav,ユキナーごめん、帰るの1日ずれることになった。ちょっと寄るところができて
2/2109.wav,そーれはありがたいなぁー。後でお礼言わないとだな。手土産もたくさん持っていくか。
2/2110.wav,ところでユキナー、お前今どこにいる?外にいるのか?
2/2111.wav,そのままの意味だが、今まさに、俺はお前の実家にいる。目の前にお母さんとお父さんもいるぞ
2/2112.wav,そんなにすぐ帰って来れるのかー?今県外の温泉地にいるだろう
2/2113.wav,じゃあなんで俺にも実家にも嘘ついたんだ?旅行行くって正直に言えなかったんだ?
2/2114.wav,ま、それも全部嘘ってバレてるんだけどな
2/2115.wav,動画も、LINEのやり取りも色々あるぞ。ぜーんぶプリントアウトして今お母さんたちに見てもらってるから。これだけで写真集が5冊は作れそうだ
2/2116.wav,でーもしっかり確認してもらわなきゃならないだろ
2/2117.wav,子供ができた時期を逆算した時期
2/2118.wav,疑うようなことをしてるからだろうが
2/2119.wav,チャーンスをくれ?おかしなこと言うなよ!今まで何回も本当のことを言うチャンスをあげたじゃないか!なのにお前は嘘ばっかりついて、言い訳ばっかりしてさ!
2/2120.wav,昔の友達とどんどん疎遠になって、まさきも出張が多いし、あまり構ってくれないし。一日中同じ家事の…
2/2121.wav,お前の昔の友達からだよ。会うたびにマウンティングされて嫌になったんだと。結婚してから人が変わったとも言ってたなー
2/2122.wav,そっちの事情なんか知るもんか!とりあえず明日弁護士の連絡先送っておくから。もう夜遅いし、寝るわ。それじゃあおやすみー
2/2123.wav,ユキナは魔男とお金のことで揉め、喧嘩別れした挙句、実家に子供を置いて失踪したらしい。子供の方はユキナの兄夫婦の養子になったそうだ
2/2125.wav,わたしのセレブな価値観に、元旦那がついてこれなかったの
2/2126.wav,つまり、住む世界が違ったのねー。かわいそうだから、元々住んでいた、貧民の世界に返してあげたの。
2/2127.wav,その後必要があれば弁護士をお願いすることになるので
2/2129.wav,こちらの準備が整うまでは、一切返信しませんので
2/2130.wav,ちょーっとちょっとー、まさしさんがわたしの家に来たわよー。家から追い出したんですってね。
2/2131.wav,その日のうちに振り込んであげるから
2/2132.wav,既読無視なんて、貧乏女が生意気よ
2/2133.wav,ちょーっとちょっと、今日たまたまパパの会社の前を通ったんだけど、なんでそのかさんが出入りしてんのー？あっ、もしかして
2/2134.wav,離婚スタートのために就活してるのかしら？
2/2135.wav,一体どういうこと?昨日、慰謝料の額を聞いたら
2/2136.wav,早速パパがお金を持ってきてくれるはずだったのに
2/2137.wav,一体パパに何したのよ？
2/2138.wav,パパがダメなら、マサシさんに慰謝料払ってもらおうとしたのに、無理って言われた。ママまで離婚届を置いて出て行っちゃったのよ
2/2139.wav,パパが、見張られていた?
2/2140.wav,法的な疑問点があるなら弁護士さんに伺ってちょうだい。それでは、今後はその弁護士さん経由で、お願いしますね
2/2141.wav,それとは別に、わたしへの慰謝料が2人分振り込まれまった
2/2142.wav,ご視聴ありがとうございました。動画の評価とチャンネル登録、よろしくお願いします。それでは、次回の動画でお会いしましょう。
2/2143.wav,娘を嫁に出す父親の心境が複雑だというのは、よく聞く話だし、全然わからないわけじゃないよ。でも、殴るのはダメだ
2/2144.wav,うっ、被害届を取り下げてくれ。妻と娘を、説得してくれ。あと、会社をクビになりそうなんだ
2/2145.wav,会いたい。そこで、今の返事を聞かせて。
2/2146.wav,あきのうの答えはわかっていたけれど、直接返事を聞きたくて、すぐに彼女のもとへ向かいました
2/2147.wav,そのあとすぐ、俺たちは同棲を開始
2/2148.wav,彼女のお母さんも、離婚が成立した今は、俺たちの近所で一人暮らしを満喫されています。
2/2149.wav,娘に縁を切られ、妻に離婚され。
2/2150.wav,和解する日が来るかどうかは、今後の彼次第なので、今は、あきのとの幸せを
2/2151.wav,がとうございました。動画の評価とチャンネル登録、よろしくお願いします。それでは、次回の動画でお会いしまし
2/2153.wav,このサボテンに向かってー
2/2154.wav,おい!おい!
2/2155.wav,別の世界が広がっていたっていうことですねー。お、すごいよねこれ
2/2156.wav,皆様、はじめまして。山本レオと申します。
2/2157.wav,マジ今日ハイパー疲れた。天然すぎる後輩ちゃんの面倒を見てたら、こんな時間。
2/2158.wav,ついでに何品か作り置きしておいたから。
2/2159.wav,この前彼氏に振られて思ったの。
2/2160.wav,この仕事は排除するべきですね
2/2161.wav,けんげんせよ。きったまえ
2/2162.wav,ここにて命ずる。我が名はトワクシンクンなり
2/2163.wav,何かあるよ。運命よ、ここに出でよ
2/2164.wav,セイキンさんのチャンネルがね、候補で出てきましたね。あの、もうリスナーだと認知され、ましたね。いや、まぁリスナー、リスナーなんですけど。
2/2165.wav,見てください、このコショ、コショ話的なのがもう全部枯れて、声になってない。アポロ。
2/2166.wav,あ、ただないなぁ、やっぱあれですね。皆さん、これを機にね、あのー
2/2167.wav,ここで試合終了ですよ
2/2169.wav,出なかったな、はぁぁぁぁぁうっせ!あ、出た
2/2170.wav,はい!それじゃ、リモートいきたいと思いまーす!
2/2171.wav,千五百、に起こす。おだ、が、を破り
2/2172.wav,千五百、におこっ、織田、が、を破り、統一の第、となった戦いは何?
2/2174.wav,海のフォアグラ、あん肝があるので、これでどんぶりにして食べま
2/2175.wav,ご乗車、ありがとうございます。
2/2176.wav,この電車は、中百舌鳥行きです
2/2177.wav,次は、淀屋橋、市役所前で
2/2178.wav,京阪線は、お乗り換えです
2/2179.wav,美加の台と、林間田園都市から、各駅です。高野山にお越しのお客様は
2/2180.wav,京阪電車をご利用くださいまして、ありがとうございます。
2/2181.wav,淀屋橋には、12時、43分に、到着いたします。
2/2182.wav,まもなく、中書島。中書島。
2/2183.wav,三条、出町柳方面へお越しのお客様は
2/2184.wav,電車とホームの間が空いています。
2/2185.wav,お降りのお客様は、お足元にご注意ください。
2/2186.wav,左側の扉を開けます。ご注意ください。
2/2187.wav,本日も、阪急電車をご利用いただきまして、ありがとうございます。この電車は
2/2188.wav,準急、京都河原町行きです。
2/2189.wav,次は、西山天王山、西山天王山です。
2/2190.wav,今日も、JR西日本をご利用くださいまして、ありがとうございます。
2/2191.wav,この電車は、環状線外回り、弁天町、西九条、大阪方面行きです。
2/2192.wav,次は、新今宮に止まります。
2/2193.wav,お出口は、右側です。
2/2194.wav,危険物持ち込み禁止についてお知らせいたします。
2/2195.wav,東羽衣方面は、お乗り換えです。
