path,text
5/5746.wav,遥か向こうが際どく明るい
5/5747.wav,ことによると、今のも夢かも知れない
5/5748.wav,廊下の真ん中で考え込んでいると
5/5749.wav,固まって響いたかと思う間もなく
5/5750.wav,夢じゃないやっぱり事実だ
5/5751.wav,ただ外れに見える月明かりが目印だ
5/5752.wav,あ痛いと頭へ響く間に
5/5753.wav,もう足音も人声も
5/5754.wav,静まり返ってしんとしている
5/5755.wav,今夜中に勝たなければ明日勝つ
5/5756.wav,蚊がブンブン来たけれどもなんともなかった
5/5757.wav,さっきぶつけたむこうずねを撫でてみると
5/5758.wav,なんだか騒がしいので目が覚めた時は
5/5759.wav,俺の座ってた右側にある戸が
5/5760.wav,残る一人がちょっと狼狽したところを飛びかかって
5/5761.wav,肩を抑えて二三度小突き回したら
5/5762.wav,あっけにとられて目をぱちぱちさせた。
5/5763.wav,さあ俺の部屋まで来いと引っ立てると
5/5764.wav,豚はぶっても叩いても豚だから
5/5765.wav,だんだん2階から宿直部屋へ集まってくる
5/5766.wav,そんな面をして男と言われるか？
5/5767.wav,小使いが学校に騒動がありますって
5/5768.wav,わざわざ知らせに行ったのだそうだ
5/5769.wav,これしきのことに校長を呼ぶなんて
5/5770.wav,中学校の小使いなんぞをしてるんだ
5/5771.wav,朝飯を食わないと時間に間に合わないから
5/5772.wav,しばらく俺の顔を見つめていたが
5/5773.wav,蚊がよっぽとさしたに相違ない
5/5774.wav,うですなあ。と、少し進まない返事をしたら。
5/5775.wav,これは今考えても、惜しい、と言ったら、赤シャツは顎を前の方へ突き出して
5/5776.wav,それじゃあ、まだ釣りの味はわからんですなぁ
5/5777.wav,何不足なく暮らしている上に
5/5778.wav,議論じゃかなわないと思って黙ってた
5/5779.wav,俺に見せびらかすつもりかなんかで、誘ったに違いない
5/5780.wav,そんなことで見せびらかされる俺じゃあない
5/5781.wav,まぐろの二匹や三匹釣ったってビクともするもんか
5/5782.wav,一応うちへ帰って支度を整えて
5/5783.wav,顎を撫でて玄人じみたことを云った
5/5784.wav,実は、大変嬉しかった。
5/5785.wav,ターナーとは何のことだか知らないが
5/5786.wav,これで海だとは受け取りにくいほど平だ
5/5787.wav,これからあの島を、ターナー島と名付けようじゃありませんか
5/5788.wav,仕方がないからのそのそ出て来て
5/5789.wav,マドンナの話はよそうじゃないか。
5/5790.wav,なぁに、誰もいないから大丈夫です
5/5791.wav,マドンナだろうが小旦那だろうが
5/5792.wav,わたしも江戸っ子でげすなどと言っている
5/5793.wav,赤シャツの馴染みの、芸者のあだ名か何かに違いないと思った
5/5794.wav,無人島の松の木の下に立たして
5/5795.wav,重りのような鉛がぶら下がってるだけだ
5/5796.wav,寒暖計なしで熱度を測るようなものだ
5/5797.wav,糸が水底へ着いた時分に
5/5798.wav,人差し指で呼吸をはかるんです
5/5799.wav,何かかかったと思ったら、何にもかからない
5/5800.wav,井戸端でザーザー音がするから出てみたら
5/5801.wav,教ー頭ー残念なことをしましたねー。今のは確かに、大物に違いなかったんですが。
5/5802.wav,どうーも、教頭のお手際でさえ逃げられちゃー。
5/5803.wav,浮きと睨めっくらしている連中よりは
5/5804.wav,とぐいぐい手繰り寄せた。
5/5805.wav,ようやくつらまえて、針を取ろうとするが。
5/5806.wav,どうの前叩きつけたらすぐ死んでしまった
5/5807.wav,赤シャツと野田は、驚いて見ている
5/5808.wav,俺は海の中で手をザブザブと洗って、鼻の先へあてがってみた
5/5809.wav,まだ生臭い。もうゴリゴリだ
5/5810.wav,一番槍はお手柄だが、ゴルキじゃ
5/5811.wav,そーうですねー。まるでロシアの文学者ですねー
5/5812.wav,一体、この赤シャツは悪い癖だ
5/5813.wav,帝国文学とかいう、真っ赤な雑誌を学校へ持ってきて
5/5814.wav,一生懸命に肥やしを釣っているんだ
5/5815.wav,野田などと一緒じゃつまらない
5/5816.wav,わたしは江戸っ子でげすと繰り返していたら
5/5817.wav,こんなことを考えていると
5/5818.wav,二人がくすくす笑い出した。
5/5819.wav,笑い声の間に何か言うが
5/5820.wav,んまったくです。知らないんですから。
5/5821.wav,明瞭に俺の耳に入るようにして
5/5822.wav,その後、わざとぼかしてしまった。
5/5823.wav,団子だのというところをもって推し量ってみると
5/5824.wav,日の光がだんだん弱ってきて
5/5825.wav,少しはひやりとする風が吹き出した
5/5826.wav,線香の煙のような雲が
5/5827.wav,静かにのして行ったと思ったら
5/5828.wav,いつしかそこの奥に流れ込んで
5/5829.wav,薄くもやをかけたようになった。
5/5830.wav,赤シャツが思い出したように言うと
5/5831.wav,今夜は、マドンナの君に、お会いですか?
5/5832.wav,えっへへへへ、だーい丈夫ですよー
5/5833.wav,野田は眩しそうにひっくり返って
5/5834.wav,こいつの言うことはいちいち、しゃくに触るから妙だ
5/5835.wav,注意しないと剣呑ですよ
5/5836.wav,君のためを思うから言うんだが
5/5837.wav,野田が人間並のことを言った
5/5838.wav,生徒は君の来たのを大変歓迎しているんだが
5/5839.wav,君も腹の立つこともあるだろうが
5/5840.wav,自分だけ得をするほど嫌いなことはない
5/5841.wav,いろいろの事情たー、どんな事情です？
5/5842.wav,それが、少し込み入っているんだが。
5/5843.wav,まあ、だんだんわかりますよ
5/5844.wav,ええなかなか込み入ってますからね。一長一短には到底わかりません。
5/5845.wav,僕が話さないでも、自然とわかってくるです
5/5846.wav,あなた方から話し出したから伺うんです
5/5847.wav,そーりゃあごもっともだー
5/5848.wav,後をつけないのは無責任ですね
5/5849.wav,これだけのことを言っておきましょう
5/5850.wav,教師は初めての経験である
5/5851.wav,まだ、経験に乏しいというんですがねー
5/5852.wav,23年4ヶ月ですから
5/5853.wav,さあそこで思わぬ辺りから
5/5854.wav,誰がのじたって怖くはないです
5/5855.wav,気をつけないといけないというんです
5/5856.wav,船頭と釣りの話をしている
5/5857.wav,まだ判然と証拠のないことだから
5/5858.wav,とにかく、せっかく君が来たもんだから
5/5859.wav,ここで失敗しちゃあ僕らも君を呼んだ甲斐がない
5/5860.wav,世のためにも当人のためにもなるだろう
5/5861.wav,単純や新卒が笑われる世の中じゃしようがない
5/5862.wav,自分だけ悪いことをしなくっても
5/5863.wav,世の中には磊落なように見えても
5/5864.wav,浜に立って、赤シャツに挨拶する
5/5865.wav,俺は船端からやっと掛け声をして
5/5866.wav,しかし、教頭だけに、野田より難しいことを言う
5/5867.wav,弱虫は親切なものだから
5/5868.wav,親切を無にしちゃ筋が違う
5/5869.wav,気の合った友達が悪者だなんて
5/5870.wav,一番人望のある教師だというから
5/5871.wav,やろうと思ったら、大抵のことはできるかもしれないが
5/5872.wav,ここばかりが米ができるわけでもあるまい
5/5873.wav,第一番に氷水を奢ったのは
5/5874.wav,他人から恩を受けて黙っているのは
5/5875.wav,教育のないばあさんだから仕方がない
5/5876.wav,銭金で買える返礼じゃない
5/5877.wav,ひいき目は恐ろしいものだ
5/5878.wav,眠くなったからぐうぐう寝てしまった
5/5879.wav,終いには赤シャツまで出てきたが
5/5880.wav,山嵐の机の上へ肘をついて
5/5881.wav,堂々と俺の肩を持つべきだ
5/5882.wav,とても役には立たないと一人で決めてしまった
5/5883.wav,そんな無法なことをしちゃ困る
5/5884.wav,こんなばあさんにあってはかなわない
5/5885.wav,学校に騒動を起こすつもりできたんじゃなかろう
5/5886.wav,妙に常識を外れた質問をするから
5/5887.wav,みんなあんな連中ならつまらんものだ
5/5888.wav,つじつまの合わない論理に欠けた注文をして
5/5889.wav,別段なんになるという了見もなかった
5/5890.wav,今日は君のおかげで遅刻したんだ
5/5891.wav,氷水を奢られる因縁がないから出すんだ
5/5892.wav,なぜ思い出したように今時分返すんだ
5/5893.wav,奢られるのが嫌だから返すんだ
5/5894.wav,一銭五厘受け取ればそれでいい
5/5895.wav,下宿を出ようが出まいが俺の勝手だ
5/5896.wav,君に出てもらいたいと言うから
5/5897.wav,それでももう一応確かめるつもりで
5/5898.wav,今朝あそこへ寄って詳しい話を聞いてきたんだ
5/5899.wav,訳があるなら、訳を話すが順だ
5/5900.wav,失敬千万なことを言うな
5/5901.wav,下宿の女房に足を拭かせた
5/5902.wav,とにかく向こうじゃ君に困ってるんだ
5/5903.wav,下宿料の10円や15円は
5/5904.wav,一体そんな言いがかりを言うようなところへ
5/5905.wav,負け嫌いな大きな声を出す
5/5906.wav,恥ずかしいことをした覚えはないんだから
5/5907.wav,野田のひょうたん面を射抜いた時に
5/5908.wav,野田は突然真面目な顔をして
5/5909.wav,会議というものは生まれて初めてだから
5/5910.wav,不都合としか思われない事件に
5/5911.wav,別段の考えもなかったようだ
5/5912.wav,野田の顔はどう考えても劣等だ
5/5913.wav,山嵐の方がはるかに趣がある
5/5914.wav,そんなことで脅かされてたまるもんかと
5/5915.wav,一つ二つと頭数を勘定してみる
5/5916.wav,このくらい関係の深い人だから
5/5917.wav,何遍も繰り返して頼んだ
5/5918.wav,狸は例の通りもったいぶって
5/5919.wav,何か事件がある度に
5/5920.wav,密かに慚愧の念に絶えんが
5/5921.wav,ひとたび起こった以上は仕方がない
5/5922.wav,諸君のご承知の通りであるからして
5/5923.wav,参考のためにお述べください
5/5924.wav,校長だの狸だのというものは
5/5925.wav,えらいことを言うもんだと感心した
5/5926.wav,この女は中々想像の強い女で
5/5927.wav,生徒を処分するのはやめにして
5/5928.wav,俺の尻だと吹き散らかす奴が
5/5929.wav,こんな条理にかなわない議論を吐いて
5/5930.wav,お庭へブランコをこしらえあそばせ
5/5931.wav,一番大いに弁じてやろうと思って
5/5932.wav,西洋間は、一つでたくさんです。
5/5933.wav,マドンナから巻き上げたに相違ない
5/5934.wav,白い麻を使うもんだ
5/5935.wav,何か完結があると起こるもので
5/5936.wav,だから表面上に現れたところだけで
5/5937.wav,勝手な計画を一人で並べていた
5/5938.wav,未来のために良くないかとも思われます
5/5939.wav,正念決起のものであるから
5/5940.wav,そのあたりをご斟酌になって
5/5941.wav,なるべく寛大なお取り計らいを
5/5942.wav,家なんか欲しくもなんともなかった
5/5943.wav,半ば無意識だって放免するつもりだろう
5/5944.wav,とうとうと述べ立てなくっちゃつまらない
5/5945.wav,二言か三言で必ず行き詰ってしまう
5/5946.wav,弁説はなかなか達者だから
5/5947.wav,ちょっと副案を作ってみようと
5/5948.wav,野田のくせに意見を述べるなんて生意気だ
5/5949.wav,今回のバッタ事件及び突貫事件は
5/5950.wav,この際奮ってみずから顧みて
5/5951.wav,ただいま校長及び、教頭のお述べになったお説は
5/5952.wav,実に肯綮に当たった、凱切なお考えで
5/5953.wav,野田の言うことは言語はあるが意味がない
5/5954.wav,嵌合のべつに陳列する義理で
5/5955.wav,徹頭徹尾賛成いたしますという
5/5956.wav,副案も出ないうちに立ち上がってしまった
5/5957.wav,一体生徒が全然悪いです
5/5958.wav,新しく来た教師だと思って
5/5959.wav,生徒が悪いことも悪いが
5/5960.wav,かえって反動を起こしてはいけないでしょう
5/5961.wav,かんな方に賛成します
5/5962.wav,また何か言うと笑うに違いない。
5/5963.wav,今まで黙って聞いていた山嵐が
5/5964.wav,他には認められんのであります
5/5965.wav,それは失言かと思います
5/5966.wav,某氏が宿直に当たられたのは
5/5967.wav,まだ生徒に接せられてから20日に満たぬ頃であります
5/5968.wav,評価し得る余地がないのであります
5/5969.wav,軽侮されべき至当な理由があって
5/5970.wav,生徒の行為に斟酌を加える理由もありましょうが
5/5971.wav,信頼の先生を愚弄するような軽薄な生徒を看過しては
5/5972.wav,学校の威信に関わることと思います
5/5973.wav,単に学問を授けるばかりではない!
5/5974.wav,武士的元気な鼓吹をすると同時に
5/5975.wav,我々はこの学校に職を奉じているので
5/5976.wav,寄宿生一同を厳罰に処する上に
5/5977.wav,当該教師の面前において
5/5978.wav,謝罪の意を表せしむるのを
5/5979.wav,俺はなんだか、非常に嬉しかった
5/5980.wav,俺の言おうと思うところを、俺の代わりに
5/5981.wav,しばらくして、山嵐はまた起立した。
5/5982.wav,ただいまちょっと、失念して言い落としましたから申します
5/5983.wav,当夜の宿直員は、宿直中外出して、温泉に行かれたようであるが
5/5984.wav,一行の留守番を引き受けながら
5/5985.wav,咎める者のないのを幸いに
5/5986.wav,場所もあろうに温泉などへ入場に行くなどというのは
5/5987.wav,あとからすぐ、人の失策を暴いている
5/5988.wav,攻撃されても仕方がない。
5/5989.wav,と言って、着席したら、一同がまた笑い出した
5/5990.wav,俺が何か言いさえすれば笑う。
5/5991.wav,貴様ら、これほど自分の悪いことを、公に悪かったと断言できるか？
5/5992.wav,とうとう大変なことになってしまった
5/5993.wav,飲食店などに出入しないことにしたい
5/5994.wav,送別会などの節は特別であるが
5/5995.wav,上等でない場所へ行くのはよしたい
5/5996.wav,狸の言うことなんかよくわからないが
5/5997.wav,蕎麦と団子の嫌いなものと
5/5998.wav,単に物質的な快楽ばかり求めるべきではない
5/5999.wav,または新体詩や俳句を作るとか
6/6000.wav,精神的娯楽を求めなくっては
6/6001.wav,妙な顔をして、互いに目と目を見合せている
6/6002.wav,親父が小遣いをくれないには
6/6003.wav,兄は商業学校を卒業した
6/6004.wav,九州の支店に口があって
6/6005.wav,東京でまだ学問をしなければならない
6/6006.wav,任地へ出立すると云い出した
6/6007.wav,しばらく前途の方向のつくまで
6/6008.wav,神田の小川町へ下宿していた
6/6009.wav,人手に渡るのを大いに残念がったが
6/6010.wav,直ちに引き払わねばならぬ始末だ
6/6011.wav,ようやく決心した返事をした
6/6012.wav,まず今日には差し支えなく暮らしていたから
6/6013.wav,年来住みなれた家の方がいいと言って
6/6014.wav,兄にしては感心なやり方だ
6/6015.wav,商売らしい商売がやれるわけでもなかろう
6/6016.wav,一年に200円ずつ使えば
6/6017.wav,20行あるうちで1行もわからない
6/6018.wav,物理学校の前を通りかかったら
6/6019.wav,これも親譲りの無鉄砲から起こった失策だ
6/6020.wav,教師以外に何をしようという当てもなかったから
6/6021.wav,今度は鎌倉どころではない
6/6022.wav,針の先ほど小さく見える。
6/6023.wav,今に学校を卒業すると
6/6024.wav,一人で決めて一人で喋るから
6/6025.wav,こっちは困って顔を赤くした
6/6026.wav,清の自慢を聞いていたかわからぬ
6/6027.wav,封建時代の主従のように考えていた
6/6028.wav,もう経つという三日前に清を訪ねたら
6/6029.wav,俺の来たのを見て起き直るが早いか
6/6030.wav,それでも妙な顔をしているから
6/6031.wav,越後の笹飴なんて聞いたこともない
6/6032.wav,そんなものは要らないと言っても、なかなか承知しない
6/6033.wav,小さな声で云った。目に涙がいっぱい溜まっている
6/6034.wav,俺は泣かなかった。しかし、もう少しで泣くところであった
6/6035.wav,もう大丈夫だろうと思って。
6/6036.wav,ふーと云って、汽船が泊まると、艀が岸を離れて、漕ぎ寄せてきた
6/6037.wav,こんなところに我慢ができるものかと思ったが
6/6038.wav,赤ふんは岸へ漕ぎ戻して来た
6/6039.wav,中学校の愛歌も知らぬ奴があるものか
6/6040.wav,ところへ妙な筒っぽを着た男が来て
6/6041.wav,港屋とかいう宿屋へ連れて来た。
6/6042.wav,汽車で二里ばかり行かなくっちゃいけない
6/6043.wav,ゴロゴロと5分ばかり動いたと思ったら
6/6044.wav,それから車を雇って中学校へ来たら
6/6045.wav,宿直はちょっと用足しに出たと
6/6046.wav,校長でも尋ねようかと思ったが
6/6047.wav,質屋のカンタロウの屋号と同じだから
6/6048.wav,鞄を放り出したまま出て行った
6/6049.wav,涼しそうな部屋がたくさん空いている
6/6050.wav,飯は下宿のよりもだいぶうまかった
6/6051.wav,東京は良いところでございましょう。
6/6052.wav,笹ぐるみむしゃむしゃ食っている
6/6053.wav,笹は毒だからよしたらよかろう。
6/6054.wav,俺が呆れ返って大きな口を開いて
6/6055.wav,粗末に取扱われると聞いていた
6/6056.wav,これからは月給をもらうんだから構わない
6/6057.wav,むやみにきょうさんな音がするので
6/6058.wav,精出して、勉強してくれ。
6/6059.wav,海の中へ放りこんでしまった
6/6060.wav,今に、職員に紹介してやるから。
6/6061.wav,まず大体のことを飲み込んでおいてもらおう
6/6062.wav,それから教育の精神について
6/6063.wav,俺は無論いい加減に聞いていたが
6/6064.wav,校長の言うようにはとてもできない
6/6065.wav,無闇に法外な注文をする。
6/6066.wav,はるばるこんな田舎へ来るもんか
6/6067.wav,ここで断って帰っちまおうと思った
6/6068.wav,財布の中には9円なにがししかない
6/6069.wav,嘘をつくよりましだと思って
6/6070.wav,あなたのおっしゃる通りにはできません
6/6071.wav,召喚！参上！
6/6072.wav,おかえり、なさいませ
6/6073.wav,かわいいー、愛おしさがスパークしちゃうよー!
6/6075.wav,未来を不安に思う必要はない
6/6076.wav,根拠のない自信を道しるべに
6/6077.wav,自分を信じて、進め
6/6078.wav,諦めなければ必ず、道は開けるから
6/6079.wav,と、被告に対し、その
6/6080.wav,戦々せるげんもん、実にしてこの自尊と、ともん、安定と、せきすうにして
6/6081.wav,なお、防線を継続せんか
6/6082.wav,ついに、我が民族の滅亡を招来するのみならず、ひいて人類の文明をも、破却すべし。
6/6083.wav,職ひつに殉じ、使命に倒れたる者及び、その遺族に思いを致せば、ごないためにさく。
6/6084.wav,相手の注目が、コイに行ってる間に、さりげなくこのように、
6/6085.wav,見えましたかね？えー映し変えて、やることもできます。
6/6086.wav,そしてデッグを近づけておいて、ここで振ってさん、に、いちのリズムで、
6/6087.wav,って感じで、やると、自声がつかめま
6/6088.wav,あのージュウオンくんのモノマネする感じです
6/6089.wav,え咳払い声、がなり声ですね
6/6090.wav,今週の、クイズショルダー、サック
6/6091.wav,ファーストクエスチョンの、クイズのジャンルは?
6/6094.wav,これであなたの人生が変わるかもしれません本当にいいんですね
6/6095.wav,フランスの、首都は
6/6097.wav,こちらの数式を解け、これはむつかしいですか
6/6098.wav,それでは、ネクストクエスチョン。次の問題は、分かりにくい問題です。次の問題はこちら
6/6099.wav,ボツワナ共和国の首都は
6/6102.wav,で、よくーワンちゃん達ね、食べさせてるわけ
6/6103.wav,え、これは本当ねー
6/6104.wav,もうこれはとぉーほんとにこれ、楽しみだなぁってなってんの
6/6105.wav,今日コツはー、ほんつにー、このイツゴをー、もうほんとに食べたいと思ってるわけ。
6/6106.wav,これいちごってさぁ
6/6107.wav,今、だいたい何個ゆってるわけー？
6/6108.wav,それなのに6個しかないわけー？
6/6109.wav,それなのにさぁ、いちごはさぁ、6個しかないわけ？
6/6110.wav,てことはー、6個しかー食べれないってわけじゃん。こうなってきたらさぁ
6/6111.wav,この6個もさぁ、食べる必要あんのかなってなっちゃうじゃん
6/6112.wav,一時間長くなってるわけでしょー？
6/6113.wav,ちょっとこれはちょっとワンちゃんだなぁ。
6/6114.wav,四、三、二、一
6/6115.wav,うわっ!いた!マジ!?
6/6116.wav,さっきから答えている人たちと
6/6118.wav,で、歌える人いないですか?答え知ってる人
6/6119.wav,いやちょっとやばいなぁいやちょっとほんとこの時間に練習しようと
6/6121.wav,やっと手に入れた!はぁーはぁー、グランドラインのかい!
6/6123.wav,はい。水まるまるまるまる度、は、ダンのいいとこだけを真似して、プロデュースはまるまるまる、だから
6/6124.wav,っていうー時点でもう、ずっと聞いてるとかいうね
6/6125.wav,今、この、話をしてんの?
6/6126.wav,ありがとうございます。高橋真理子さんの、ごめんね、でした
6/6127.wav,今しょこたんと、堀米さんがやったんですよね？
6/6128.wav,あ赤隊四兄弟ですー
6/6129.wav,でもこれ桂太さんは初めてー英孝さんのキラ
6/6130.wav,いやいやいや持ってきてますー
6/6131.wav,今回はバージョン三点ゼロにて追加された新予想
6/6132.wav,会心発動時の効果音についてん動画です
6/6133.wav,まず最初に結論ですが、鳴ってます
6/6134.wav,気づきません、知りません、無理があります、鳴っているようで、鳴っていない、鳴っていないようで、鳴っている
6/6135.wav,普通にやってりゃ、まずわからん。音を制限して耳をすましても、わからん
6/6136.wav,いや、わかる。この三点で進行していきます。ちなみに敵を倒した時の音、というのは非常にわかりやすいです
6/6137.wav,普通に日常的に戦闘している上では
6/6138.wav,それくらいマジで微々たる差のものが多く
6/6139.wav,キャラクターボイスもオフに。完全に敵と自分の攻撃エフェクト音のみに、音量を絞りました
6/6140.wav,お分かり、いただけただだろうか
6/6141.wav,一番会心会心しているのです。ってことで槍と体験は、割とまだわかりやすかったです。周囲の音消して
6/6142.wav,じゃあね、逆に片手剣とか弓とか、ほうきならどうなのかっていうの
6/6143.wav,片手剣においてはもしかすると、音が少し際立って聞こえるかもしれませんが
6/6144.wav,はい、ということで、バージョン三点ゼロで追加された新予想
6/6145.wav,なっているようで、なっていない、に等しい
6/6147.wav,砂がこうね、何種類か、見えないかな？お肉をあいまして、細かい砂から
6/6148.wav,砂利と言うのかな?うん。これぐらいの大きさの…
6/6149.wav,で、こっち側を、そうですね、そう
6/6150.wav,あまり混ぜてしまうと後で
6/6151.wav,より、まーその、過程を楽しむ、要素も
6/6152.wav,そういう意味でも、こういったエーエスエムアール
6/6153.wav,でしょ、んで、えーっと、この、波打ち際を…
6/6154.wav,木の陰に、潜んでいる魚を狙っている
6/6155.wav,これで、眠ったし
6/6156.wav,ち持っといてもいいかな？よ
